{
  "$schema": "https://json-schema.org/draft/2020-12/schema",
  "title": "Music ML Evaluation Summary",
  "type": "object",
  "description": "Schema for summary.json generated by this project.",
  "properties": {
    "$schema": {
      "type": "string",
      "description": "Relative path to this schema file."
    },
    "mode": {
      "type": "string",
      "description": "Run mode, such as single_split."
    },
    "labels": {
      "type": "array",
      "description": "Ordered playlist labels used by the model.",
      "items": {
        "type": "string"
      }
    },
    "metric_definitions": {
      "type": "object",
      "description": "Human-readable explanations for metric fields.",
      "additionalProperties": {
        "type": "object",
        "properties": {
          "description": {
            "type": "string"
          },
          "range": {
            "type": "string"
          },
          "direction": {
            "type": "string"
          }
        },
        "required": [
          "description",
          "range",
          "direction"
        ],
        "additionalProperties": false
      }
    },
    "validation": {
      "type": "object",
      "description": "Validation summary for single-split or per-fold selected epoch.",
      "properties": {
        "loss": {
          "type": "number",
          "description": "Model loss. Lower is better."
        },
        "metrics": {
          "$ref": "#/$defs/metricBundle"
        }
      },
      "additionalProperties": true
    },
    "test": {
      "type": "object",
      "description": "Test summary.",
      "properties": {
        "loss": {
          "type": "number",
          "description": "Model loss. Lower is better."
        },
        "metrics": {
          "$ref": "#/$defs/metricBundle"
        }
      },
      "additionalProperties": true
    },
    "config": {
      "type": "object",
      "description": "Evaluation configuration for k-fold runs.",
      "additionalProperties": true
    },
    "guarded_playlists": {
      "type": "array",
      "description": "Playlists protected by the recall guard.",
      "items": {
        "type": "string"
      }
    },
    "folds": {
      "type": "array",
      "description": "Per-fold k-fold evaluation summaries.",
      "items": {
        "type": "object",
        "additionalProperties": true
      }
    },
    "aggregate_metrics": {
      "type": "object",
      "description": "Aggregate mean/std metrics across folds.",
      "additionalProperties": {
        "type": "number"
      }
    }
  },
  "$defs": {
    "metricBundle": {
      "type": "object",
      "properties": {
        "micro_f1": {
          "type": "number",
          "minimum": 0.0,
          "maximum": 1.0,
          "description": "F1 across all label decisions pooled together."
        },
        "macro_f1": {
          "type": "number",
          "minimum": 0.0,
          "maximum": 1.0,
          "description": "Average F1 across playlists, weighting each playlist equally."
        },
        "micro_precision": {
          "type": "number",
          "minimum": 0.0,
          "maximum": 1.0,
          "description": "Fraction of predicted positives that were correct across all labels pooled together."
        },
        "macro_precision": {
          "type": "number",
          "minimum": 0.0,
          "maximum": 1.0,
          "description": "Average precision across playlists."
        },
        "micro_recall": {
          "type": "number",
          "minimum": 0.0,
          "maximum": 1.0,
          "description": "Fraction of true positives found across all labels pooled together."
        },
        "macro_recall": {
          "type": "number",
          "minimum": 0.0,
          "maximum": 1.0,
          "description": "Average recall across playlists."
        }
      },
      "additionalProperties": true
    }
  },
  "additionalProperties": true
}